yorum_islenmis,Duygu
efendim pl k kat ağlayan bir video yapın usr ka video daala hai brbrsir benim önemli sadec videonuzu anlıyoruz sadec brberhump isteğini dürüst öğrencilerden izliyorum,Nötr
bunun teşekkürl lütfen sql fazla soru ekleyin,Nötr
video teşekkür ederim kardeşim brmi dumbass sqlde bir histogram planlayacağımızı düşündüm,Negatif
başka bir harika video,Nötr
merhaba efendim ml algoritmalarında kullanılan türlü parsel üzerind bir video yapmanız mümkündür pifirplot ggplot dağılım histkd verilen veri kümesind hangi arsa hangi noktaların parselleri çizmek imp olduğunu vb,Nötr
